{
  "run_id": "d3t-parity",
  "git_sha": "abc123def456",
  "steps": [
    {
      "name": "test",
      "tool": "cargo test",
      "exit_code": 0,
      "duration_ms": 1200,
      "findings": []
    },
    {
      "name": "lint",
      "tool": "clippy",
      "exit_code": 1,
      "duration_ms": 340,
      "findings": [
        {
          "tool": "clippy",
          "severity": "warning",
          "message": "variável não usada",
          "file": "src/x.rs",
          "line": 12
        },
        {
          "tool": "clippy",
          "severity": "note",
          "message": "achado sem localização"
        }
      ]
    }
  ],
  "verdict": "fail",
  "produced_at": "2026-07-10T00:00:00Z"
}
